{
  "schemaVersion": 2,
  "compilerVersion": "2.0.0",
  "sourceGraphHash": "sha256:b5494d4fc44970adc5bad179b22a4f154900e892ce58bc3de2b3e78b73bbb621",
  "skills": {
    "context-manager": {
      "id": "context-manager",
      "displayName": "context-manager",
      "version": "1.0.0",
      "description": "Compatibility alias for context-os context selection and budgeting.",
      "category": "general",
      "type": "instruction-only",
      "entrypoint": "SKILL.md",
      "activation": {
        "mode": "auto",
        "globs": []
      },
      "entrypointHash": "sha256:7f836a591ec0eeeb040354ca1aaa3b26b9ca71b4f22a81fd8f965012966aff7a",
      "resourceTreeHash": "sha256:49aa0e0e79a04aaae6ac7e87702b3657249591404e88288e0282081807c4bd6c",
      "estimatedTokens": 332,
      "source": ".agents/core/skills/context-manager/skill.yaml",
      "signals": {
        "aliases": [
          "context-manager"
        ],
        "keywords": [],
        "fileGlobs": [],
        "packages": []
      },
      "dependencies": {
        "requires": [],
        "optional": [],
        "conflicts": []
      },
      "context": {
        "priority": 50,
        "estimatedTokens": 332
      },
      "resources": [
        {
          "path": "EXAMPLES.md",
          "mode": "on-demand"
        },
        {
          "path": "SKILL.md",
          "mode": "on-demand"
        },
        {
          "path": "TROUBLESHOOTING.md",
          "mode": "on-demand"
        },
        {
          "path": "VALIDATION.json",
          "mode": "on-demand"
        },
        {
          "path": "references/context-rules.md",
          "mode": "on-demand"
        }
      ],
      "deprecated": true,
      "canonical": "context-os",
      "rules": []
    },
    "context-os": {
      "id": "context-os",
      "displayName": "context-os",
      "version": "1.0.0",
      "description": "Configure and debug ContextOS manifests, resolver selection, profiles, budgets, and adapter exports.",
      "category": "general",
      "type": "compiler",
      "entrypoint": "SKILL.md",
      "activation": {
        "mode": "auto",
        "globs": []
      },
      "entrypointHash": "sha256:3bd53d8f9e1028530d5072b1c6a0e72708947524309314bbf3dd914411ddbca9",
      "resourceTreeHash": "sha256:dfe1f3529521be1a7037a29e641b3e8fb2d1eac987773a7649e971bb905cc02e",
      "estimatedTokens": 718,
      "source": ".agents/core/skills/context-os/skill.yaml",
      "signals": {
        "aliases": [
          "context-os"
        ],
        "keywords": [],
        "fileGlobs": [],
        "packages": []
      },
      "dependencies": {
        "requires": [],
        "optional": [],
        "conflicts": []
      },
      "context": {
        "priority": 50,
        "estimatedTokens": 718
      },
      "resources": [
        {
          "path": "EXAMPLES.md",
          "mode": "on-demand"
        },
        {
          "path": "SKILL.md",
          "mode": "on-demand"
        },
        {
          "path": "TROUBLESHOOTING.md",
          "mode": "on-demand"
        },
        {
          "path": "VALIDATION.json",
          "mode": "on-demand"
        },
        {
          "path": "packs.yaml",
          "mode": "on-demand"
        },
        {
          "path": "references/context-rules.md",
          "mode": "on-demand"
        },
        {
          "path": "references/pipeline.md",
          "mode": "on-demand"
        },
        {
          "path": "references/project-graph.md",
          "mode": "on-demand"
        },
        {
          "path": "rules.yaml",
          "mode": "on-demand"
        }
      ],
      "deprecated": false,
      "canonical": null,
      "rules": []
    },
    "engineering-workflow": {
      "id": "engineering-workflow",
      "displayName": "engineering-workflow",
      "version": "1.0.0",
      "description": "Scope implementation work, verify behavior, and report evidence using a proportional lifecycle.",
      "category": "general",
      "type": "instruction-only",
      "entrypoint": "SKILL.md",
      "activation": {
        "mode": "auto",
        "globs": []
      },
      "entrypointHash": "sha256:1c7d28c6f896e8c27d7e144c0880602c6640d904116b3949358124083b40b629",
      "resourceTreeHash": "sha256:43fdd51dd1e05bca0d668ecf230dd3acf25ec5adb85e32d693f0dd35292c1fce",
      "estimatedTokens": 481,
      "source": ".agents/core/skills/engineering-workflow/skill.yaml",
      "signals": {
        "aliases": [
          "engineering-workflow"
        ],
        "keywords": [],
        "fileGlobs": [],
        "packages": []
      },
      "dependencies": {
        "requires": [],
        "optional": [],
        "conflicts": []
      },
      "context": {
        "priority": 50,
        "estimatedTokens": 481
      },
      "resources": [
        {
          "path": "EXAMPLES.md",
          "mode": "on-demand"
        },
        {
          "path": "SKILL.md",
          "mode": "on-demand"
        },
        {
          "path": "TROUBLESHOOTING.md",
          "mode": "on-demand"
        },
        {
          "path": "VALIDATION.json",
          "mode": "on-demand"
        },
        {
          "path": "references/workflow.md",
          "mode": "on-demand"
        }
      ],
      "deprecated": false,
      "canonical": null,
      "rules": []
    },
    "gemini-precision": {
      "id": "gemini-precision",
      "displayName": "gemini-precision",
      "version": "1.0.0",
      "description": "Execution guidance for Gemini: inspect code, preserve scope, and report relevant verification evidence.",
      "category": "general",
      "type": "instruction-only",
      "entrypoint": "SKILL.md",
      "activation": {
        "mode": "auto",
        "globs": []
      },
      "entrypointHash": "sha256:19840b3681878bbd0a4f5d5c6f3367e1435a3a11393dc8e8ae62ad0a99cbbd01",
      "resourceTreeHash": "sha256:3cb01bf69c6e47e7462f7fbce3e51c2c1ce606a739ac51a79dc1ef1adaa682fd",
      "estimatedTokens": 503,
      "source": ".agents/core/skills/gemini-precision/skill.yaml",
      "signals": {
        "aliases": [
          "gemini-precision"
        ],
        "keywords": [],
        "fileGlobs": [],
        "packages": []
      },
      "dependencies": {
        "requires": [],
        "optional": [],
        "conflicts": []
      },
      "context": {
        "priority": 50,
        "estimatedTokens": 503
      },
      "resources": [
        {
          "path": "EXAMPLES.md",
          "mode": "on-demand"
        },
        {
          "path": "SKILL.md",
          "mode": "on-demand"
        },
        {
          "path": "TROUBLESHOOTING.md",
          "mode": "on-demand"
        },
        {
          "path": "VALIDATION.json",
          "mode": "on-demand"
        }
      ],
      "deprecated": false,
      "canonical": null,
      "rules": []
    },
    "gstack-roles": {
      "id": "gstack-roles",
      "displayName": "gstack-roles",
      "version": "1.0.0",
      "description": "Compatibility alias for engineering-workflow with optional specialist review perspectives.",
      "category": "general",
      "type": "instruction-only",
      "entrypoint": "SKILL.md",
      "activation": {
        "mode": "auto",
        "globs": []
      },
      "entrypointHash": "sha256:05cb4b80e5f39696de70e008df351f1b80177734b32d7e1d864271526128f85b",
      "resourceTreeHash": "sha256:e7f5c36e41a656c739258dbb7cce075493b9b7dfca8ce02e28bc990bacac28b1",
      "estimatedTokens": 345,
      "source": ".agents/core/skills/gstack-roles/skill.yaml",
      "signals": {
        "aliases": [
          "gstack-roles"
        ],
        "keywords": [],
        "fileGlobs": [],
        "packages": []
      },
      "dependencies": {
        "requires": [],
        "optional": [],
        "conflicts": []
      },
      "context": {
        "priority": 50,
        "estimatedTokens": 345
      },
      "resources": [
        {
          "path": "EXAMPLES.md",
          "mode": "on-demand"
        },
        {
          "path": "SKILL.md",
          "mode": "on-demand"
        },
        {
          "path": "TROUBLESHOOTING.md",
          "mode": "on-demand"
        },
        {
          "path": "VALIDATION.json",
          "mode": "on-demand"
        },
        {
          "path": "references/roles.md",
          "mode": "on-demand"
        }
      ],
      "deprecated": true,
      "canonical": "engineering-workflow",
      "rules": []
    },
    "ponytail-mindset": {
      "id": "ponytail-mindset",
      "displayName": "ponytail-mindset",
      "version": "1.0.0",
      "description": "Choose a minimal maintainable implementation for substantive Build tasks while preserving safety and verification.",
      "category": "general",
      "type": "instruction-only",
      "entrypoint": "SKILL.md",
      "activation": {
        "mode": "auto",
        "globs": []
      },
      "entrypointHash": "sha256:914ea397b7fa90606c72bdf192637901eb492f83b172e5d8b5115285de3bad76",
      "resourceTreeHash": "sha256:bd957cbbe44d2f06259ff3390cda05895befd139a0fa3797b90d38206de516c5",
      "estimatedTokens": 452,
      "source": ".agents/core/skills/ponytail-mindset/skill.yaml",
      "signals": {
        "aliases": [
          "ponytail-mindset"
        ],
        "keywords": [],
        "fileGlobs": [],
        "packages": []
      },
      "dependencies": {
        "requires": [],
        "optional": [],
        "conflicts": []
      },
      "context": {
        "priority": 50,
        "estimatedTokens": 452
      },
      "resources": [
        {
          "path": "EXAMPLES.md",
          "mode": "on-demand"
        },
        {
          "path": "SKILL.md",
          "mode": "on-demand"
        },
        {
          "path": "TROUBLESHOOTING.md",
          "mode": "on-demand"
        },
        {
          "path": "VALIDATION.json",
          "mode": "on-demand"
        },
        {
          "path": "references/minimalism.md",
          "mode": "on-demand"
        }
      ],